{
    "$schema": "http://json-schema.org/draft-04/schema#",
    "id": "https://community.rockrms.com/schemas/2024-10-01/theme.json",
    "description": "RockRMS Theme Definition",
    "type": "object",
    "properties": {
        "name": {
            "type": "string",
            "description": "The name of the theme that will be displayed in the UI."
        },
        "description": {
            "type": "string",
            "description": "Additional information about the theme."
        },
        "purpose": {
            "type": "string",
            "description": "The purpose of theme described by this file. This is used to determine which sites can use which themes. If not specified then it will be a 'web' theme.",
            "enum": [
                "web",
                "checkin"
            ]
        },
        "availableIconSets": {
            "type": "array",
            "description": "The font icon sets that are supported by this theme. If not specified then default values will be provided by Rock.",
            "items": {
                "type": "string",
                "enum": ["fontawesome", "tabler"]
            }
        },
        "fields": {
            "type": "array",
            "description": "The fields.",
            "items": {
                "oneOf": [
                    {
                        "$ref": "#/definitions/headingField"
                    },
                    {
                        "$ref": "#/definitions/spacerField"
                    },
                    {
                        "$ref": "#/definitions/literalField"
                    },
                    {
                        "$ref": "#/definitions/colorField"
                    },
                    {
                        "$ref": "#/definitions/textField"
                    },
                    {
                        "$ref": "#/definitions/imageField"
                    },
                    {
                        "$ref": "#/definitions/fileField"
                    },
                    {
                        "$ref": "#/definitions/switchField"
                    },
                    {
                        "$ref": "#/definitions/panelField"
                    }
                ]
            }
        }
    },
    "required": [
        "name"
    ],
    "definitions": {
        "variableName": {
            "type": "string",
            "description": "The display name of the variable."
        },
        "variable": {
            "type": "string",
            "description": "The CSS variable name to be generated for this value.",
            "pattern": "^[a-zA-Z0-9_-]+$"
        },
        "description": {
            "type": "string",
            "description": "The optional help text to display with the input control."
        },
        "literalField": {
            "type": "object",
            "properties": {
                "type": {
                    "type": "string",
                    "description": "A field that displays a single line of text. The value is written unformatted to the CSS file.",
                    "enum": [
                        "literal"
                    ]
                },
                "name": {
                    "$ref": "#/definitions/variableName"
                },
                "variable": {
                    "$ref": "#/definitions/variable"
                },
                "description": {
                    "$ref": "#/definitions/description"
                },
                "default": {
                    "type": "string",
                    "description": "The default value to use for this variable."
                },
                "multiline": {
                    "type": "boolean",
                    "description": "Determines if the input box will display and accept multiple lines of text."
                },
                "width": {
                    "type": "string",
                    "description": "The suggested width of the input box.",
                    "enum": [
                        "sm",
                        "md",
                        "lg",
                        "xl",
                        "xxl"
                    ]
                }
            },
            "description": "A field that displays a single line of text.",
            "additionalProperties": false,
            "required": [
                "type",
                "name",
                "variable",
                "default"
            ]
        },
        "textField": {
            "type": "object",
            "properties": {
                "type": {
                    "type": "string",
                    "description": "A field that displays a single line of text. The value is wrapped in quotes and escaped when written to CSS.",
                    "enum": [
                        "text"
                    ]
                },
                "name": {
                    "$ref": "#/definitions/variableName"
                },
                "variable": {
                    "$ref": "#/definitions/variable"
                },
                "description": {
                    "$ref": "#/definitions/description"
                },
                "default": {
                    "type": "string",
                    "description": "The default value to use for this variable."
                },
                "multiline": {
                    "type": "boolean",
                    "description": "Determines if the input box will display and accept multiple lines of text."
                },
                "width": {
                    "type": "string",
                    "description": "The suggested width of the input box.",
                    "enum": [
                        "sm",
                        "md",
                        "lg",
                        "xl",
                        "xxl"
                    ]
                }
            },
            "description": "A field that displays a single line of text.",
            "additionalProperties": false,
            "required": [
                "type",
                "name",
                "variable",
                "default"
            ]
        },
        "colorField": {
            "type": "object",
            "properties": {
                "type": {
                    "type": "string",
                    "description": "A field that will contain a CSS color value.",
                    "enum": [
                        "color"
                    ]
                },
                "name": {
                    "$ref": "#/definitions/variableName"
                },
                "variable": {
                    "$ref": "#/definitions/variable"
                },
                "description": {
                    "$ref": "#/definitions/description"
                },
                "default": {
                    "type": "string",
                    "description": "The default value to use for this variable."
                }
            },
            "description": "A field that will contain a CSS color value.",
            "required": [
                "type",
                "name",
                "variable",
                "default"
            ]
        },
        "imageField": {
            "type": "object",
            "properties": {
                "type": {
                    "type": "string",
                    "description": "A field that will contain an image reference.",
                    "enum": [
                        "image"
                    ]
                },
                "name": {
                    "$ref": "#/definitions/variableName"
                },
                "variable": {
                    "$ref": "#/definitions/variable"
                },
                "description": {
                    "$ref": "#/definitions/description"
                },
                "default": {
                    "type": "string",
                    "description": "The default value to use for this variable."
                }
            },
            "description": "A field that will contain an image reference.",
            "additionalProperties": false,
            "required": [
                "type",
                "name",
                "variable",
                "default"
            ]
        },
        "fileField": {
            "type": "object",
            "properties": {
                "type": {
                    "type": "string",
                    "description": "A field that will contain a file reference.",
                    "enum": [
                        "file"
                    ]
                },
                "name": {
                    "$ref": "#/definitions/variableName"
                },
                "variable": {
                    "$ref": "#/definitions/variable"
                },
                "description": {
                    "$ref": "#/definitions/description"
                },
                "default": {
                    "type": "string",
                    "description": "The default value to use for this variable."
                }
            },
            "description": "A field that will contain a file reference.",
            "additionalProperties": false,
            "required": [
                "type",
                "name",
                "variable",
                "default"
            ]
        },
        "switchField": {
            "type": "object",
            "properties": {
                "type": {
                    "type": "string",
                    "description": "A field that will include one of two custom CSS content templates.",
                    "enum": [
                        "switch"
                    ]
                },
                "name": {
                    "$ref": "#/definitions/variableName"
                },
                "variable": {
                    "$ref": "#/definitions/variable"
                },
                "description": {
                    "$ref": "#/definitions/description"
                },
                "onContent": {
                    "type": "string",
                    "description": "The CSS content to include when the value is on."
                },
                "offContent": {
                    "type": "string",
                    "description": "The CSS content to include when the value is off."
                },
                "onValue": {
                    "type": "string",
                    "description": "The literal value to set the variable to when the value is on."
                },
                "offValue": {
                    "type": "string",
                    "description": "The literal value to set the variable to when the value is off."
                }
            },
            "description": "A field that will include one of two custom CSS content templates.",
            "required": [
                "type",
                "name",
                "variable"
            ]
        },
        "headingField": {
            "type": "object",
            "properties": {
                "type": {
                    "type": "string",
                    "description": "A section heading that can be used to group related fields together.",
                    "enum": [
                        "heading"
                    ]
                },
                "title": {
                    "type": "string",
                    "minLength": 1,
                    "description": "The title to show in the heading."
                },
                "description": {
                    "type": "string",
                    "description": "The additional text to display below the heading."
                }
            },
            "description": "A section heading that can be used to group related fields together.",
            "additionalProperties": false,
            "required": [
                "type",
                "title"
            ]
        },
        "spacerField": {
            "type": "object",
            "properties": {
                "type": {
                    "type": "string",
                    "description": "Inserts a small amount of whitespace between fields.",
                    "enum": [
                        "spacer"
                    ]
                }
            },
            "description": "Inserts a small amount of whitespace between fields.",
            "additionalProperties": false,
            "required": [
                "type"
            ]
        },
        "panelField": {
            "type": "object",
            "properties": {
                "type": {
                    "type": "string",
                    "description": "A panel that will contain other fields.",
                    "enum": [
                        "panel"
                    ]
                },
                "title": {
                    "type": "string",
                    "minLength": 1,
                    "description": "The text that will be displayed in the panel header."
                },
                "expanded": {
                    "type": "boolean",
                    "description": "If set then the panel will be expanded by default."
                },
                "fields": {
                    "type": "array",
                    "description": "The fields that will be displayed in this panel.",
                    "items": {
                        "oneOf": [
                            {
                                "$ref": "#/definitions/headingField"
                            },
                            {
                                "$ref": "#/definitions/spacerField"
                            },
                            {
                                "$ref": "#/definitions/literalField"
                            },
                            {
                                "$ref": "#/definitions/colorField"
                            },
                            {
                                "$ref": "#/definitions/textField"
                            },
                            {
                                "$ref": "#/definitions/imageField"
                            },
                            {
                                "$ref": "#/definitions/fileField"
                            },
                            {
                                "$ref": "#/definitions/switchField"
                            }
                        ]
                    }
                }
            },
            "description": "A panel that will contain other fields.",
            "additionalProperties": false,
            "required": [
                "type",
                "title"
            ]
        }
    }
}