{
    "$schema": "https://community.rockrms.com/schema/2024-10-01/theme.schema.json",
    "name": "NextGenCheckin",
    "description": "The default theme for the next generation check-in system.",
    "purpose": "checkin",
    "availableIconSets": ["fontawesome"],
    "fields": [
        {
            "type": "color",
            "name": "Primary Color",
            "variable": "color-primary",
            "description": "The primary color used to highlight screen elements, such as the main button.",
            "default": "#ee7725"
        },
        {
            "type": "image",
            "name": "Checkin Logo",
            "variable": "logo-image",
            "description": "The logo that wll be displayed throughout the Checkin.",
            "default": "~/Assets/Images/rock-logo-gray.svg"
        }
    ]
}
